{
  "id": "philips-led-lighting-focus-2013",
  "option": "Prioritize LED lighting investments",
  "rationale": "Rapid LED cost declines and regulatory demand signals made LED lighting the most attractive growth vector after the TV exit.",
  "timestamp": "2013-05-15T09:30:00Z",
  "decision_maker": "Frans van Houten",
  "tags": [
    "growth_investment",
    "regulation"
  ],
  "supported_by": [
    "phil-e3",
    "phil-e4"
  ],
  "based_on": [
    "philips-exit-tv-2011"
  ],
  "transitions": [
    "trans-phil-2011-2013",
    "trans-phil-2013-2016"
  ],
  "x-extra": {}
}