{
  "id": "panasonic-ai-supply-chain-2019",
  "option": "Implement AI-driven digital supply-chain platform",
  "rationale": "AI optimization promised double-digit inventory reduction and faster response to EV demand volatility.",
  "timestamp": "2019-10-18T15:00:00Z",
  "decision_maker": "Yuki Kusumi",
  "tags": [
    "digital_transformation",
    "supply_chain"
  ],
  "supported_by": [
    "pan-e9"
  ],
  "based_on": [
    "panasonic-ev-battery-gigafactory-2017"
  ],
  "transitions": [
    "trans-pan-2017-2019"
  ],
  "x-extra": {}
}