{
  "id": "panasonic-ev-battery-gigafactory-2017",
  "option": "Invest in Gigafactory EV battery plant",
  "rationale": "Scaling up cell production was critical to meet Tesla demand and achieve cost parity with ICE vehicles.",
  "timestamp": "2017-07-29T11:00:00Z",
  "decision_maker": "Kazuhiro Tsuga",
  "tags": [
    "capacity_expansion",
    "ev_batteries"
  ],
  "supported_by": [
    "pan-e7",
    "pan-e8"
  ],
  "based_on": [
    "panasonic-automotive-infotainment-acquisition-2014"
  ],
  "transitions": [
    "trans-pan-2014-2017",
    "trans-pan-2017-2019"
  ],
  "x-extra": {}
}