{
  "id": "panasonic-automotive-infotainment-acquisition-2014",
  "option": "Acquire AU Automotive for infotainment",
  "rationale": "Acquisition expanded Panasonic's automotive electronics portfolio and leveraged synergies with battery operations.",
  "timestamp": "2014-08-12T13:00:00Z",
  "decision_maker": "Kazuhiro Tsuga",
  "tags": [
    "m_and_a",
    "automotive_electronics"
  ],
  "supported_by": [
    "pan-e5",
    "pan-e6"
  ],
  "based_on": [
    "panasonic-exit-plasma-2012"
  ],
  "transitions": [
    "trans-pan-2012-2014",
    "trans-pan-2014-2017"
  ],
  "x-extra": {}
}