{
  "id": "panasonic-tesla-battery-partnership-2010",
  "option": "Partner with Tesla for EV batteries",
  "rationale": "Electric vehicles were gaining momentum, and a strategic supply partnership positioned Panasonic as a leader in automotive batteries.",
  "timestamp": "2010-01-07T10:00:00Z",
  "decision_maker": "Fumio Ohtsubo",
  "tags": [
    "strategic_alliance",
    "ev_batteries"
  ],
  "supported_by": [
    "pan-e1",
    "pan-e2"
  ],
  "based_on": [],
  "transitions": [
    "trans-pan-2010-2012"
  ],
  "x-extra": {}
}