{
  "id": "philips-exit-tv-2011",
  "option": "Exit television manufacturing",
  "rationale": "Margins in the commodity TV market had eroded below the firm's hurdle rate, and leadership chose to redeploy capital toward higher-margin LED lighting and health-tech.",
  "timestamp": "2011-04-18T10:00:00Z",
  "decision_maker": "Frans van Houten",
  "tags": [
    "portfolio_shift",
    "margin_pressure"
  ],
  "supported_by": [
    "phil-e1",
    "phil-e2"
  ],
  "based_on": [],
  "transitions": [
    "trans-phil-2011-2013"
  ],
  "x-extra": {}
}